"Heslář","Obsah"
"Období – kategorie","Slouží pro kategorizaci položek ve dvojstupňovém hesláři Období na základě obecnějších chronologických celků (paleolit, d. bronzová, středověk apod.)."
"Období","Heslář období umožňuje provádět relativní dataci archeologických komponent. Heslář obsahuje jak hesla obecná („pravěk“, „neolit-eneolit“), tak konkrétní archeologické kultury podřazené obecnějším heslům („gravettien“, „šárecký typ“). Při zadávání datace je vždy žádoucí užívat co nejpřesnější variantu, v případě nejistoty pak užívat hesla významově širší. Užitá hesla nikdy nevymezují rozsah, a to ani v případě hesel s pomlčkou (např. „středověk – novověk nesp.“). Taková hesla lze vysvětlit jako zahrnující, tedy ve významu: „Komponentu lze zařadit do blíže nespecifikované části období středověku až novověku.“ Heslář zahrnuje také standardizované zkratky pro jednotlivé položky. Více viz obrázek níže."
"Areál – kategorie","Slouží pro kategorizaci položek ve dvojstupňovém hesláři Areál na základě obecnějších pojmů."
"Areál","Obsažená hesla umožňují klasifikovat komponenty na základě převažujícího účelu a funkce v době své existence. Areálem aktivity může být jak dílčí objekt či budova (zámek, mlýn, lom), tak skupina objektů (polní opevnění, pohřebiště, sídliště), stejně jako plocha či lineární útvar (pole, cesta). Areál zastupuje předběžnou interpretaci archeologického kontextu, nikoli současný kontext komponenty. Každý areál automaticky implikuje přítomnost některých aktivit (sídliště -> sídlištní). V hesláři lze nastavit implicitní vztahy mezi areály a aktivitami."
"Aktivity","Heslář základních aktivit identifikovaných v rámci komponenty („sídlištní“, „pohřební“ atd.). Slouží jako doplňující údaj pro bližší specifikaci aktivit v identifikovaném areálu, případně pokud konkrétní areál nelze určit. Jedná se o systémový heslář."
