"Role","Název","Vysvětlivka","Práva"
"A","Anonym","Každý uživatel","Prohlížet a exportovat archivovaná data, tvořit výpisové sestavy"
"B","Badatel","Registrovaný uživatel, zpravidla student, archeolog nebo zájemce o archeologii","Vkládat data o samostatných akcích, vč. dokumentů"
"C","Archeolog","Pracovník organizace oprávněné k terénním archeologickým výzkumům","Vkládat a přihlašovat projekty, zapisovat zprávy o akcích, vč. dokumentů"
"D","Archivář","Pověřený pracovník archivu","Posuzovat kvalitu záznamů, vracet k dopracování nebo archivovat záznamy, editovat záznamy"
"E","Administrátor","Odpovědný pracovník IT","Dávkově vkládat data, mazat záznamy, spravovat uživatelské účty, spravovat hesláře"
