"icon","format","archival","scope","recommendation","note"
"{{< fa file >}}","PDF","TRUE","Textové dokumenty",,"Při archivaci převedeno na PDF/A"
"{{< fa image >}}","TIFF","TRUE","Obrázky, fotografie","Používat LZW kompresi (při hloubce 8 bit/24 bit)",
"{{< fa image >}}","JPEG","TRUE","Obrázky, fotografie","Nepoužívat subsampling, kompresní poměr ideálně 100 %, min. 80 %",
"{{< fa image >}}","PNG","TRUE","Obrázky, fotografie",,
"{{< fa image >}}","SVG","TRUE","Vektorová grafika",,
"{{< fa file >}}","TXT","TRUE","Krátké textové dokumenty","Kódování UTF-8, jen jednoduché soubory",
"{{< fa table >}}","CSV","TRUE","Strukturovaná data, tabulky","Kódování UFT-8",
"{{< fa table >}}","XLSX","TRUE","Strukturovaná data, tabulky","Nesmí obsahovat grafy, vnořené tabulky, makra atp.",
